Authors,Author(s) ID,Title,Year,Source title,Volume,Issue,Art. No.,Page start,Page end,Page count,Cited by,DOI,Link,Document Type,Publication Stage,Open Access,Source,EID
"Beeson, R., Namachchivaya, N.S., Perkowski, N.","57191970092;7004116225;55389754100;","APPROXIMATION OF THE FILTER EQUATION FOR MULTIPLE TIMESCALE, CORRELATED, NONLINEAR SYSTEMS",2022,"SIAM Journal on Mathematical Analysis","54","3",,"3054","3090",,,"10.1137/20M1379265","https://www.scopus.com/inward/record.uri?eid=2-s2.0-85131163450&doi=10.1137%2f20M1379265&partnerID=40&md5=2a245800f49f3eab136769a2026a9569",Article,"Final","All Open Access, Green",Scopus,2-s2.0-85131163450
"Ho, K., Beeson, R., Tomita, K., Gunasekara, O., Sinclair, A.J.","36084239500;57191970092;57216591899;57220011690;36170058800;","Analysis of information-theoretic initial sensor search method for space situation awareness",2021,"Journal of Guidance, Control, and Dynamics","44","3",,"641","645",,2,"10.2514/1.G005114","https://www.scopus.com/inward/record.uri?eid=2-s2.0-85102126737&doi=10.2514%2f1.G005114&partnerID=40&md5=1ff4fd409c216bad6b9d761b53544dcc",Article,"Final","All Open Access, Green",Scopus,2-s2.0-85102126737
"Beeson, R., Sri Namachchivaya, N.","57191970092;7004116225;","Particle filtering for chaotic dynamical systems using future right-singular vectors",2020,"Nonlinear Dynamics","102","2",,"679","696",,4,"10.1007/s11071-020-05727-y","https://www.scopus.com/inward/record.uri?eid=2-s2.0-85086169136&doi=10.1007%2fs11071-020-05727-y&partnerID=40&md5=e27e43272efad36d41e34433512da636",Article,"Final","",Scopus,2-s2.0-85086169136
"Yeong, H.C., Beeson, R.T., Namachchivaya, N.S., Perkowski, N.","47361689700;57191970092;7004116225;55389754100;","Particle Filters with Nudging in Multiscale Chaotic Systems: With Application to the Lorenz ’96 Atmospheric Model",2020,"Journal of Nonlinear Science","30","4",,"1519","1552",,7,"10.1007/s00332-020-09616-x","https://www.scopus.com/inward/record.uri?eid=2-s2.0-85079742767&doi=10.1007%2fs00332-020-09616-x&partnerID=40&md5=dc042fccbbda7d166b70ab0c02bc7f8c",Article,"Final","",Scopus,2-s2.0-85079742767
"Beeson, K.A., Beeson, R., Westbrook, G.L., Schnell, E.","56862018900;57191970092;7005404622;6701606685;","Α2δ-2 protein controls structure and function at the cerebellar climbing fiber synapse",2020,"Journal of Neuroscience","40","12",,"2403","2415",,9,"10.1523/JNEUROSCI.1514-19.2020","https://www.scopus.com/inward/record.uri?eid=2-s2.0-85082094358&doi=10.1523%2fJNEUROSCI.1514-19.2020&partnerID=40&md5=3f0de7b564464ce164fa08240cc3780b",Article,"Final","All Open Access, Bronze, Green",Scopus,2-s2.0-85082094358
"Beeson, R., Haddox, P., Karim, S., Jagannatha, B., Bunce, D., Cochran, K., Solomonik, E., Ghosh, A.","57191970092;56118846500;57220011252;55806038400;57191978618;57220005240;6507565755;51863557100;","Nlparopt: A parallel nonlinear programming solver-applications to astrodynamics related optimization",2020,"Advances in the Astronautical Sciences","171",,,"3251","3270",,,,"https://www.scopus.com/inward/record.uri?eid=2-s2.0-85096490845&partnerID=40&md5=788bef4402c7132f270e5e54b08153a0",Conference Paper,"Final","",Scopus,2-s2.0-85096490845
"Beeson, R., Tomita, K., Gunasekara, O., Sinclair, A., Ho, K.","57191970092;57216591899;57220011690;36170058800;36084239500;","Space-based target search methods using an optical sensor model for space situational awareness",2020,"Advances in the Astronautical Sciences","171",,,"4359","4373",,,,"https://www.scopus.com/inward/record.uri?eid=2-s2.0-85096473423&partnerID=40&md5=8a5e26a88082c2e3df9711c4280206be",Conference Paper,"Final","",Scopus,2-s2.0-85096473423
"Beeson, R., Namachchivaya, N.S.","57191970092;7004116225;","Efficient Nonlinear Filtering of Multiscale Systems with Specific Structure",2019,"FUSION 2019 - 22nd International Conference on Information Fusion",,,"9011425","","",,,,"https://www.scopus.com/inward/record.uri?eid=2-s2.0-85081787623&partnerID=40&md5=b32eb696fd337020008f2f1cddd3c27e",Conference Paper,"Final","",Scopus,2-s2.0-85081787623
"Yeong, H.C., Beeson, R., Namachchivaya, N.S., Perkowski, N., Sauer, P.W.","47361689700;57191970092;7004116225;55389754100;7102773962;","Dynamic data-driven adaptive observations in data assimilation for multi-scale systems",2018,"Handbook of Dynamic Data Driven Applications Systems",,,,"47","73",,1,"10.1007/978-3-319-95504-9_3","https://www.scopus.com/inward/record.uri?eid=2-s2.0-85091548848&doi=10.1007%2f978-3-319-95504-9_3&partnerID=40&md5=ea26b611048ab6b1dbec5c343ee0a52a",Book Chapter,"Final","",Scopus,2-s2.0-85091548848
"Beeson, R., Yeong, H.C., Namachchivaya, N.S., Perkowski, N.","57191970092;47361689700;7004116225;55389754100;","Reduced Order Nonlinear Filters for Multi-Scale Systems with Correlated Sensor Noise",2018,"2018 21st International Conference on Information Fusion, FUSION 2018",,,"8455704","131","141",,1,"10.23919/ICIF.2018.8455704","https://www.scopus.com/inward/record.uri?eid=2-s2.0-85054064374&doi=10.23919%2fICIF.2018.8455704&partnerID=40&md5=57816dd6cf12e8b97b8932fc63aa0a5d",Conference Paper,"Final","",Scopus,2-s2.0-85054064374
"Patel, M., Sinclair, A.J., Yeong, H.C., Beeson, R., Ho, K.","57194612747;36170058800;47361689700;57191970092;36084239500;","Dynamic sensor steering for target search for space situational awareness",2018,"Advances in the Astronautical Sciences","167",,,"2175","2188",,2,,"https://www.scopus.com/inward/record.uri?eid=2-s2.0-85069447430&partnerID=40&md5=cbbedd9283a5a03930b3ef2a33e5626e",Conference Paper,"Final","",Scopus,2-s2.0-85069447430
"Jagannatha, B.B., Shah, V., Beeson, R., Ho, K.","55806038400;57191274409;57191970092;36084239500;","Exploration of low-thrust low-energy trajectories to Earth-Moon Halo orbits",2018,"Advances in the Astronautical Sciences","162",,,"363","376",,,,"https://www.scopus.com/inward/record.uri?eid=2-s2.0-85049379669&partnerID=40&md5=d815a84b67a1598f67e50fd0115c4f8a",Conference Paper,"Final","",Scopus,2-s2.0-85049379669
"Shah, V., Aurich, J., Beeson, R., Ellison, D., Ponnapalli, K.","57191274409;57191978734;57191970092;56121764200;57202792549;","Cislunar mission design for low-thrust smallsats",2018,"Advances in the Astronautical Sciences","162",,,"825","843",,,,"https://www.scopus.com/inward/record.uri?eid=2-s2.0-85049373629&partnerID=40&md5=72b00a2a11a8d2187d8bc2cec634dd22",Conference Paper,"Final","",Scopus,2-s2.0-85049373629
"Shah, V., Beeson, R.","57191274409;57191970092;","Rapid approximation of invariant manifolds using machine learning methods",2018,"Advances in the Astronautical Sciences","162",,,"2583","2599",,,,"https://www.scopus.com/inward/record.uri?eid=2-s2.0-85049365011&partnerID=40&md5=61e15b4188a651e60f91acfacea801b4",Conference Paper,"Final","",Scopus,2-s2.0-85049365011
"Beeson, R., Shah, V., Aurich, J., Ellison, D.","57191970092;57191274409;57191978734;56121764200;","Automated solution of low energy trajectories",2018,"Advances in the Astronautical Sciences","162",,,"2203","2222",,,,"https://www.scopus.com/inward/record.uri?eid=2-s2.0-85049364489&partnerID=40&md5=a6b02522e86d09a5518af2bf1027cfc5",Conference Paper,"Final","",Scopus,2-s2.0-85049364489
"Aurich, J., Beeson, R., Coverstone, V.","57191978734;57191970092;6603784782;","Cuda-enhanced integration for quick poincaré surface intersections in a global optimization framework for low energy transfers",2017,"Advances in the Astronautical Sciences","160",,,"3919","3938",,4,,"https://www.scopus.com/inward/record.uri?eid=2-s2.0-85031020064&partnerID=40&md5=0ec356c17542d270f573db3a62c49d2d",Conference Paper,"Final","",Scopus,2-s2.0-85031020064
"Shah, V., Beeson, R., Coverstone, V.","57191274409;57191970092;6603784782;","Automated global optimization of multi-phase trajectories in the three-body problem using a variable chromosome transcription",2017,"Advances in the Astronautical Sciences","160",,,"731","750",,3,,"https://www.scopus.com/inward/record.uri?eid=2-s2.0-85030989562&partnerID=40&md5=7e612e60e7a9509d9863f6a4e4877a8c",Conference Paper,"Final","",Scopus,2-s2.0-85030989562
"Bunce, D., Beeson, R., Shah, V., Coverstone, V.","57191978618;57191970092;57191274409;6603784782;","Multi-body resonance orbit generation and application within a hybrid optimal control framework",2017,"Advances in the Astronautical Sciences","160",,,"751","770",,,,"https://www.scopus.com/inward/record.uri?eid=2-s2.0-85030980090&partnerID=40&md5=d70358077a75389198500612a632bdc1",Conference Paper,"Final","",Scopus,2-s2.0-85030980090
"Aurich, J., Beeson, R., Coverstone, V.","57191978734;57191970092;6603784782;","Automated detection of invariant manifold intersections using adaptive grid method",2016,"AIAA/AAS Astrodynamics Specialist Conference, 2016",,,,"","",18,6,"10.2514/6.2016-5437","https://www.scopus.com/inward/record.uri?eid=2-s2.0-85086950265&doi=10.2514%2f6.2016-5437&partnerID=40&md5=11f9f4312fa37c0f51c5ec504029628b",Conference Paper,"Final","",Scopus,2-s2.0-85086950265
"Ghosh, A., Beeson, R., Richardson, L., Ellison, D., Carroll, D., Coverstone, V.","51863557100;57191970092;57192683214;56121764200;57543555200;6603784782;","A non-linear parallel optimization tool (nlparopt) for solving spacecraft trajectory problems",2016,"Advances in the Astronautical Sciences","156",,,"3465","3481",,,,"https://www.scopus.com/inward/record.uri?eid=2-s2.0-85007306275&partnerID=40&md5=b3785167f6fa2af56319615b9fcf3439",Conference Paper,"Final","",Scopus,2-s2.0-85007306275
"Beeson, R., Bunce, D., Coverstone, V.","57191970092;57191978618;6603784782;","Approximation methods for quick evaluation of invariant manifolds during global optimization",2016,"AIAA/AAS Astrodynamics Specialist Conference, 2016",,,,"","",15,7,,"https://www.scopus.com/inward/record.uri?eid=2-s2.0-84995666124&partnerID=40&md5=c990e9921b830f47c64a7fe49a71dd64",Conference Paper,"Final","",Scopus,2-s2.0-84995666124
"Shah, V., Beeson, R., Coverstone, V.","57191274409;57191970092;6603784782;","A method for optimizing low-energy transfers in the earth-moon system using global transport and genetic algorithms",2016,"AIAA/AAS Astrodynamics Specialist Conference, 2016",,,,"","",19,10,,"https://www.scopus.com/inward/record.uri?eid=2-s2.0-84995578242&partnerID=40&md5=1c5b0f1583b7346a338ed583b5f86a01",Conference Paper,"Final","",Scopus,2-s2.0-84995578242
