Authors,Author(s) ID,Title,Year,Source title,Volume,Issue,Art. No.,Page start,Page end,Page count,Cited by,DOI,Link,Document Type,Publication Stage,Open Access,Source,EID
"Heinrich, M.A., Alert, R., Wolf, A.E., Košmrlj, A., Cohen, D.J.","57218936119;56415074600;56450008700;25823131200;55453565000;","Self-assembly of tessellated tissue sheets by expansion and collision",2022,"Nature Communications","13","1","4026","","",,3,"10.1038/s41467-022-31459-1","https://www.scopus.com/inward/record.uri?eid=2-s2.0-85133920034&doi=10.1038%2fs41467-022-31459-1&partnerID=40&md5=35c7145dc5508ad35625d550ff7e8578",Article,"Final","All Open Access, Gold, Green",Scopus,2-s2.0-85133920034
"LaChance, J., Schottdorf, M., Zajdel, T.J., Saunders, J.L., Dvali, S., Marshall, C., Seirup, L., Sammour, I., Chatburn, R.L., Notterman, D.A., Cohen, D.J.","57218939405;41561994900;54965406900;57221343155;57204790485;57221608265;57221601349;48761886500;7004600673;7004101476;55453565000;","PVP1—The People’s Ventilator Project: A fully open, low-cost, pressure-controlled ventilator research platform compatible with adult and pediatric uses",2022,"PLoS ONE","17","5 May","e0266810","","",,1,"10.1371/journal.pone.0266810","https://www.scopus.com/inward/record.uri?eid=2-s2.0-85129961886&doi=10.1371%2fjournal.pone.0266810&partnerID=40&md5=fcb0d8ff670ad3691a50ae7221995d08",Article,"Final","All Open Access, Gold, Green",Scopus,2-s2.0-85129961886
"LaChance, J., Suh, K., Clausen, J., Cohen, D.J.","57218939405;57226850594;57706234500;55453565000;","Learning the rules of collective cell migration using deep attention networks",2022,"PLoS Computational Biology","18","4","e1009293","","",,2,"10.1371/journal.pcbi.1009293","https://www.scopus.com/inward/record.uri?eid=2-s2.0-85130634582&doi=10.1371%2fjournal.pcbi.1009293&partnerID=40&md5=e1403463d439491ff22bd3e852b96215",Article,"Final","All Open Access, Gold, Green",Scopus,2-s2.0-85130634582
"Bourrianne, P., Chidzik, S., Cohen, D.J., Elmer, P., Hallowell, T., Kilbaugh, T.J., Lange, D., Leifer, A.M., Marlow, D.R., Meyers, P.D., Normand, E., Nunes, J., Oh, M., Page, L., Periera, T., Pivarski, J., Schreiner, H., Stone, H.A., Tank, D.W., Thiberge, S., Tully, C., Callahan, L., Creamer, M., Dvali, S., Gaillard, A.E., Glaser, A., Harrop, B.G., Johnson, D., LaChance, J.M., Lewis, T.H., Macakova, M., Murthy, M., Prevost, J., Rich, P.D., Sands, W.R., Scalice, L., Atkinson, G., Komor, M., Bradshaw, P.","56205781100;6506903106;55453565000;56448147800;57202786877;13102804800;35221944800;37052422800;57193352882;7102316379;57221253384;24758818900;57194701275;55533003000;57221251575;35227851500;57257130100;7202564376;7005634347;6602821589;35228083300;57451736400;55339728200;57204790485;57452341500;57452495600;10044475400;57452187900;57218939405;57452341600;57452341700;56745602900;57451883800;57452036800;57452036900;57452785200;57451883900;57452644900;57452645000;","Inexpensive Multipatient Respiratory Monitoring System for Helmet Ventilation During COVID-19 Pandemic",2022,"Journal of Medical Devices, Transactions of the ASME","16","1","011003","","",,2,"10.1115/1.4053386","https://www.scopus.com/inward/record.uri?eid=2-s2.0-85124588433&doi=10.1115%2f1.4053386&partnerID=40&md5=6fe8994119f6d6c9a82c69d4ad8438a5",Article,"Final","All Open Access, Hybrid Gold, Green",Scopus,2-s2.0-85124588433
"Hart, K.C., Sim, J.Y., Hopcroft, M.A., Cohen, D.J., Tan, J., Nelson, W.J., Pruitt, B.","56704523000;38562023300;8972646900;55453565000;56410269900;7401693814;57195133576;","Correction to: An Easy-to-Fabricate Cell Stretcher Reveals Density-Dependent Mechanical Regulation of Collective Cell Movements in Epithelia (Cellular and Molecular Bioengineering, (2021), 10.1007/s12195-021-000689-6)",2021,"Cellular and Molecular Bioengineering","14","6",,"661","662",,,"10.1007/s12195-021-00695-8","https://www.scopus.com/inward/record.uri?eid=2-s2.0-85112785538&doi=10.1007%2fs12195-021-00695-8&partnerID=40&md5=1494a640a276afd86604eb55295e50af",Erratum,"Final","",Scopus,2-s2.0-85112785538
"Hart, K.C., Sim, J.Y., Hopcroft, M.A., Cohen, D.J., Tan, J., Nelson, W.J., Pruitt, B.L.","56704523000;38562023300;8972646900;55453565000;56410269900;7401693814;57195133576;","An Easy-to-Fabricate Cell Stretcher Reveals Density-Dependent Mechanical Regulation of Collective Cell Movements in Epithelia",2021,"Cellular and Molecular Bioengineering","14","6",,"569","581",,1,"10.1007/s12195-021-00689-6","https://www.scopus.com/inward/record.uri?eid=2-s2.0-85111405238&doi=10.1007%2fs12195-021-00689-6&partnerID=40&md5=3e120054b992d881db3cdafe9f55d3ef",Article,"Final","All Open Access, Hybrid Gold, Green",Scopus,2-s2.0-85111405238
"Zajdel, T.J., Shim, G., Cohen, D.J.","54965406900;57211364832;55453565000;","Come together: On-chip bioelectric wound closure",2021,"Biosensors and Bioelectronics","192",,"113479","","",,9,"10.1016/j.bios.2021.113479","https://www.scopus.com/inward/record.uri?eid=2-s2.0-85109569361&doi=10.1016%2fj.bios.2021.113479&partnerID=40&md5=45e1b548de0b98ca1911cb24ccea08b9",Article,"Final","All Open Access, Hybrid Gold, Green",Scopus,2-s2.0-85109569361
"Nirody, J.A., Duran, L.A., Johnston, D., Cohen, D.J.","55156107300;57218687251;57223093357;55453565000;","Tardigrades exhibit robust interlimb coordination across walking speeds and terrains",2021,"Proceedings of the National Academy of Sciences of the United States of America","118","35","e2107289118","","",,8,"10.1073/pnas.2107289118","https://www.scopus.com/inward/record.uri?eid=2-s2.0-85113496544&doi=10.1073%2fpnas.2107289118&partnerID=40&md5=48b3405c6d947f97afbef7f08be348e9",Article,"Final","All Open Access, Bronze, Green",Scopus,2-s2.0-85113496544
"Shim, G., Devenport, D., Cohen, D.J.","57211364832;6505774315;55453565000;","Overriding native cell coordination enhances external programming of collective cell migration",2021,"Proceedings of the National Academy of Sciences of the United States of America","118","29","e2101352118","","",,14,"10.1073/pnas.2101352118","https://www.scopus.com/inward/record.uri?eid=2-s2.0-85110386987&doi=10.1073%2fpnas.2101352118&partnerID=40&md5=d43f237037330e1bfbb4aa541708656e",Article,"Final","All Open Access, Hybrid Gold, Green",Scopus,2-s2.0-85110386987
"LaChance, J., Cohen, D.J.","57218939405;55453565000;","Practical fluorescence reconstruction microscopy for large samples and low-magnification imaging",2020,"PLoS Computational Biology","16","12 December","e1008443","","",,7,"10.1371/journal.pcbi.1008443","https://www.scopus.com/inward/record.uri?eid=2-s2.0-85098918622&doi=10.1371%2fjournal.pcbi.1008443&partnerID=40&md5=8a02116a41f943519e54a4ee284261d4",Article,"Final","All Open Access, Gold, Green",Scopus,2-s2.0-85098918622
"Heinrich, M.A., Alert, R., Lachance, J.M., Zajdel, T.J., Mrlj, A.K., Cohen, D.J.","57218936119;56415074600;57218939405;54965406900;57218935882;55453565000;","Size-dependent patterns of cell proliferation and migration in freely-expanding epithelia",2020,"eLife","9",,"e58945","1","21",,14,"10.7554/ELIFE.58945","https://www.scopus.com/inward/record.uri?eid=2-s2.0-85090849006&doi=10.7554%2fELIFE.58945&partnerID=40&md5=594aa36b6452817e173afe31ba86c66d",Article,"Final","All Open Access, Gold, Green",Scopus,2-s2.0-85090849006
"Zajdel, T.J., Shim, G., Wang, L., Rossello-Martinez, A., Cohen, D.J.","54965406900;57211364832;57212152439;57217181378;55453565000;","SCHEEPDOG: Programming Electric Cues to Dynamically Herd Large-Scale Cell Migration",2020,"Cell Systems","10","6",,"506","514.e3",,26,"10.1016/j.cels.2020.05.009","https://www.scopus.com/inward/record.uri?eid=2-s2.0-85086659241&doi=10.1016%2fj.cels.2020.05.009&partnerID=40&md5=90ad004e67cd5f1ee8caec0afb26e58c",Article,"Final","All Open Access, Hybrid Gold, Green",Scopus,2-s2.0-85086659241
"Bisaria, A., Hayer, A., Garbett, D., Cohen, D., Meyer, T.","53363303800;8546094600;8889746100;55453565000;7403382771;","Membrane-proximal F-actin restricts local membrane protrusions and directs cell migration",2020,"Science","368","6496",,"1205","1210",,57,"10.1126/science.aay7794","https://www.scopus.com/inward/record.uri?eid=2-s2.0-85086424857&doi=10.1126%2fscience.aay7794&partnerID=40&md5=91d855f7323cb1a44c1c8a5a6dda3061",Article,"Final","All Open Access, Green",Scopus,2-s2.0-85086424857
"Cohen, D.J., Nelson, W.J.","55453565000;7401693814;","Secret handshakes: cell–cell interactions and cellular mimics",2018,"Current Opinion in Cell Biology","50",,,"14","19",,8,"10.1016/j.ceb.2018.01.001","https://www.scopus.com/inward/record.uri?eid=2-s2.0-85042914497&doi=10.1016%2fj.ceb.2018.01.001&partnerID=40&md5=1271280ff6face6981e396eb8cb5867d",Review,"Final","All Open Access, Green",Scopus,2-s2.0-85042914497
"Cohen, D.J.","55453565000;","Sorting Things Out: Cell Sorting during Hydra Regeneration",2017,"Biophysical Journal","113","12",,"2577","2578",,,"10.1016/j.bpj.2017.11.007","https://www.scopus.com/inward/record.uri?eid=2-s2.0-85038376555&doi=10.1016%2fj.bpj.2017.11.007&partnerID=40&md5=7fafa9ddae25722efef7b28ab20a0929",Short Survey,"Final","All Open Access, Bronze, Green",Scopus,2-s2.0-85038376555
"Gloerich, M., Bianchini, J.M., Siemers, K.A., Cohen, D.J., Nelson, W.J.","25958650300;57039738600;6506365444;55453565000;7401693814;","Cell division orientation is coupled to cell-cell adhesion by the E-cadherin/LGN complex",2017,"Nature Communications","8",,"13996","","",,89,"10.1038/ncomms13996","https://www.scopus.com/inward/record.uri?eid=2-s2.0-85008395778&doi=10.1038%2fncomms13996&partnerID=40&md5=0904b4eb96d73896560a8be06d3fcb17",Article,"Final","All Open Access, Gold, Green",Scopus,2-s2.0-85008395778
"Cohen, D.J., Gloerich, M., Nelson, W.J.","55453565000;25958650300;7401693814;","Epithelial self-healing is recapitulated by a 3D biomimetic E-cadherin junction",2016,"Proceedings of the National Academy of Sciences of the United States of America","113","51",,"14698","14703",,27,"10.1073/pnas.1612208113","https://www.scopus.com/inward/record.uri?eid=2-s2.0-85006377252&doi=10.1073%2fpnas.1612208113&partnerID=40&md5=8bbace7c2118506941fdd61f83b659ca",Article,"Final","All Open Access, Green",Scopus,2-s2.0-85006377252
"Murali, P., Izyumin, I., Prabhu, S., Cohen, D., Boser, B.","6507589480;36116742700;56058639700;55453565000;7006604685;","A magnetic flow cytometer with integrated microfluidics",2014,"Technical Digest - Solid-State Sensors, Actuators, and Microsystems Workshop",,,,"159","162",,1,"10.31438/trf.hh2014.44","https://www.scopus.com/inward/record.uri?eid=2-s2.0-84920520030&doi=10.31438%2ftrf.hh2014.44&partnerID=40&md5=f497301e780d1a2a7aaf1fc86b7f75dc",Conference Paper,"Final","All Open Access, Bronze",Scopus,2-s2.0-84920520030
"Cohen, D.J., Nelson, W.J., Maharbiz, M.M.","55453565000;7401693814;6506828902;","Erratum: Galvanotactic control of collective cell migration in epithelial monolayers (Nature Materials (2014) 13 (409-417))",2014,"Nature Materials","13","5",,"530","",,,"10.1038/nmat3948","https://www.scopus.com/inward/record.uri?eid=2-s2.0-84899068415&doi=10.1038%2fnmat3948&partnerID=40&md5=308773ad864b86f83c2a2a2bbcf437b6",Erratum,"Final","All Open Access, Bronze",Scopus,2-s2.0-84899068415
"Murali, P., Izyumin, I., Cohen, D., Chien, J.-C., Niknejad, A.M., Boser, B.","6507589480;36116742700;55453565000;8951989800;56505644700;7006604685;","A CMOS micro-flow cytometer for magnetic label detection and classification",2014,"Digest of Technical Papers - IEEE International Solid-State Circuits Conference","57",,"6757497","422","423",,13,"10.1109/ISSCC.2014.6757497","https://www.scopus.com/inward/record.uri?eid=2-s2.0-84898064029&doi=10.1109%2fISSCC.2014.6757497&partnerID=40&md5=96c84673dce8fe387b6dd55126ec979f",Conference Paper,"Final","",Scopus,2-s2.0-84898064029
"Cohen, D.J., Nelson, W.J., Maharbiz, M.M.","55453565000;7401693814;6506828902;","Galvanotactic control of collective cell migration in epithelial monolayers",2014,"Nature Materials","13","4",,"409","417",,109,"10.1038/nmat3891","https://www.scopus.com/inward/record.uri?eid=2-s2.0-84896657908&doi=10.1038%2fnmat3891&partnerID=40&md5=f3a53dab82b5c77d8233c8a5f19a042d",Article,"Final","",Scopus,2-s2.0-84896657908
"Jadhav, A.D., Aimo, I., Cohen, D., Ledochowitsch, P., Maharbiz, M.M.","36911346600;55822128300;55453565000;24175560900;6506828902;","Cyborg eyes: Microfabricated neural interfaces implanted during the development of insect sensory organs produce stable neurorecordings in the adult",2012,"Proceedings of the IEEE International Conference on Micro Electro Mechanical Systems (MEMS)",,,"6170340","937","940",,8,"10.1109/MEMSYS.2012.6170340","https://www.scopus.com/inward/record.uri?eid=2-s2.0-84860479860&doi=10.1109%2fMEMSYS.2012.6170340&partnerID=40&md5=58965f9c9c99c896b44e313ae5431c06",Conference Paper,"Final","",Scopus,2-s2.0-84860479860
"Cohen, D.J., Mitra, D., Peterson, K., Maharbiz, M.M.","55453565000;57212720287;35362914500;6506828902;","A highly elastic, capacitive strain gauge based on percolating nanotube networks",2012,"Nano Letters","12","4",,"1821","1825",,412,"10.1021/nl204052z","https://www.scopus.com/inward/record.uri?eid=2-s2.0-84859707215&doi=10.1021%2fnl204052z&partnerID=40&md5=d1d8cc3254dd0acdedbfb250d3142d0e",Article,"Final","",Scopus,2-s2.0-84859707215
"Libby, T., Moore, T.Y., Chang-Siu, E., Li, D., Cohen, D.J., Jusufi, A., Full, R.J.","36698067400;56645540700;36159316100;54881162200;55453565000;24067050100;7003993278;","Tail-assisted pitch control in lizards, robots and dinosaurs",2012,"Nature","481","7380",,"181","186",,222,"10.1038/nature10710","https://www.scopus.com/inward/record.uri?eid=2-s2.0-84855800416&doi=10.1038%2fnature10710&partnerID=40&md5=7709fd5db36d0b24aa8506b5add00910",Article,"Final","",Scopus,2-s2.0-84855800416
"Chen, J., Bly, R.A., Saad, M.M., Alkhodary, M.A., El-Backly, R.M., Cohen, D.J., Kattamis, N., Fatta, M.M., Moore, W.A., Arnold, C.B., Marei, M.K., Soboyejo, W.O.","57196106161;14719027300;57190842232;57208907735;25224802400;55453565000;22940750700;37070652400;14719727800;7203014096;6603958364;35565458000;","In-vivo study of adhesion and bone growth around implanted laser groove/RGD-functionalized Ti-6Al-4V pins in rabbit femurs",2011,"Materials Science and Engineering C","31","5",,"826","832",,25,"10.1016/j.msec.2010.12.019","https://www.scopus.com/inward/record.uri?eid=2-s2.0-79956067849&doi=10.1016%2fj.msec.2010.12.019&partnerID=40&md5=1217cf7153dd3d2b8eea1a113e6cc79c",Article,"Final","All Open Access, Bronze",Scopus,2-s2.0-79956067849
"Sato, H., Cohen, D., Maharbiz, M.M.","7410400905;55453565000;6506828902;","Building Interfaces to Developing Cells and Organisms: From Cyborg Beetles to Synthetic Biology",2011,"CMOS Biomicrosystems: Where Electronics Meet Biology",,,,"325","354",,2,"10.1002/9781118016497.ch12","https://www.scopus.com/inward/record.uri?eid=2-s2.0-84886711328&doi=10.1002%2f9781118016497.ch12&partnerID=40&md5=4ed546b3503ac23d3cb422cd72b138b7",Book Chapter,"Final","",Scopus,2-s2.0-84886711328
"Marei, M.K., Saad, M.M., El-Backly, R.M., Alkhodary, M.A., Bly, R.A., Cohen, D.J., Chen, J., Fata, M.M., Soboyejo, W.O., Nageeb, M., Rashad, A., Ahmed, D.K., Abd El-Aty, R.H.","6603958364;57190842232;25224802400;57208907735;14719027300;55453565000;22950166700;13610581200;35565458000;56661649600;8618036700;55212854300;55212267100;","Bone engineering around laser grooved/RGD -coated titanium surfaces",2010,"European Cells and Materials","19","SUPPL.1",,"37","",,,,"https://www.scopus.com/inward/record.uri?eid=2-s2.0-84860825737&partnerID=40&md5=b9c6dc175f1df962289714e56c80f52d",Conference Paper,"Final","",Scopus,2-s2.0-84860825737
"Cohen, D.J., Morfino, R.C., Maharbiz, M.M.","55453565000;35068426600;6506828902;","A modified consumer inkjet for spatiotemporal control of gene expression",2009,"PLoS ONE","4","9","e7086","","",,24,"10.1371/journal.pone.0007086","https://www.scopus.com/inward/record.uri?eid=2-s2.0-70349436997&doi=10.1371%2fjournal.pone.0007086&partnerID=40&md5=83dbebd43ca439e68720342cc55a47c6",Article,"Final","All Open Access, Gold, Green",Scopus,2-s2.0-70349436997
