Authors,Author(s) ID,Title,Year,Source title,Volume,Issue,Art. No.,Page start,Page end,Page count,Cited by,DOI,Link,Document Type,Publication Stage,Open Access,Source,EID
"Li, Q., Bou-Zeid, E., Anderson, W., Grimmond, S., Hultmark, M.","56518712900;6603009057;55747457800;55188785600;22957764800;","Quality and reliability of LES of convective scalar transfer at high Reynolds numbers",2016,"International Journal of Heat and Mass Transfer","102",,,"959","970",,35,"10.1016/j.ijheatmasstransfer.2016.06.093","https://www.scopus.com/inward/record.uri?eid=2-s2.0-84978286095&doi=10.1016%2fj.ijheatmasstransfer.2016.06.093&partnerID=40&md5=e35c143794870083a164b1229f73b415",Article,"Final","All Open Access, Bronze, Green",Scopus,2-s2.0-84978286095
"Samie, M., Watmuff, J.H., Van Buren, T., Hutchins, N., Marusic, I., Hultmark, M., Smits, A.J.","57191961294;6701626486;55252645500;15925318900;6603687789;22957764800;7102735299;","Modelling and operation of sub-miniature constant temperature hot-wire anemometry",2016,"Measurement Science and Technology","27","12","125301","","",,4,"10.1088/0957-0233/27/12/125301","https://www.scopus.com/inward/record.uri?eid=2-s2.0-84995520640&doi=10.1088%2f0957-0233%2f27%2f12%2f125301&partnerID=40&md5=6ba233c27d93b484f9ec8b6d340546d2",Article,"Final","",Scopus,2-s2.0-84995520640
"Kiefer, J., Miller, M.A., Hultmark, M., Hansen, M.O.L.","57191968356;57199377017;22957764800;35567263200;","Effects of finite aspect ratio on wind turbine airfoil measurements",2016,"Journal of Physics: Conference Series","753","2","022040","","",,6,"10.1088/1742-6596/753/2/022040","https://www.scopus.com/inward/record.uri?eid=2-s2.0-84995528728&doi=10.1088%2f1742-6596%2f753%2f2%2f022040&partnerID=40&md5=d9df8177d2298be6d76c88d96ddb8705",Conference Paper,"Final","All Open Access, Bronze, Green",Scopus,2-s2.0-84995528728
"Miller, M.A., Kiefer, J., Westergaard, C., Hultmark, M.","57199377017;57191968356;57193928446;22957764800;","Model Wind Turbines Tested at Full-Scale Similarity",2016,"Journal of Physics: Conference Series","753","3","032018","","",,5,"10.1088/1742-6596/753/3/032018","https://www.scopus.com/inward/record.uri?eid=2-s2.0-84995376410&doi=10.1088%2f1742-6596%2f753%2f3%2f032018&partnerID=40&md5=b2b115b5e7f635c695e96d52d0381888",Conference Paper,"Final","All Open Access, Bronze, Green",Scopus,2-s2.0-84995376410
"Davies, G., Hsieh, A.G., Hultmark, M., Mueller, M.E., Steingart, D.A.","56666600500;57214616191;22957764800;7402452551;7801388816;","Utilization of hyper-dendritic zinc during high rate discharge in alkaline electrolytes",2016,"Journal of the Electrochemical Society","163","7",,"A1340","A1347",,12,"10.1149/2.0891607jes","https://www.scopus.com/inward/record.uri?eid=2-s2.0-85020271948&doi=10.1149%2f2.0891607jes&partnerID=40&md5=bf6608bd9c64dc68cbeea1bf232a19e9",Article,"Final","",Scopus,2-s2.0-85020271948
"Hultmark, M., Marusic, I., McKeon, B.J., Morrison, J.F.","22957764800;6603687789;6701372729;8870495700;","Introduction to Topical Issue on Extreme Flows",2016,"Experiments in Fluids","57","1","3","1","2",,2,"10.1007/s00348-015-2094-4","https://www.scopus.com/inward/record.uri?eid=2-s2.0-84949564467&doi=10.1007%2fs00348-015-2094-4&partnerID=40&md5=12f191ccd02d134d1859181e5d218267",Editorial,"Final","All Open Access, Bronze, Green",Scopus,2-s2.0-84949564467
"Hutchins, N., Monty, J.P., Hultmark, M., Smits, A.J.","15925318900;23028284400;22957764800;7102735299;","A direct measure of the frequency response of hot-wire anemometers: temporal resolution issues in wall-bounded turbulence",2015,"Experiments in Fluids","56","1",,"","",18,38,"10.1007/s00348-014-1856-8","https://www.scopus.com/inward/record.uri?eid=2-s2.0-84934892128&doi=10.1007%2fs00348-014-1856-8&partnerID=40&md5=ff1294e4bd949182147f77fe00df32b7",Article,"Final","All Open Access, Green",Scopus,2-s2.0-84934892128
"Bahri, C., Arwatz, G., George, W.K., Mueller, M.E., Hultmark, M.","55946453000;24340842900;7202536034;7402452551;22957764800;","Self-similarity of passive scalar flow in grid turbulence with a mean cross-stream gradient",2015,"Journal of Fluid Mechanics","780",,,"215","225",,6,"10.1017/jfm.2015.439","https://www.scopus.com/inward/record.uri?eid=2-s2.0-84941045664&doi=10.1017%2fjfm.2015.439&partnerID=40&md5=f8ccc88b9a2c385b924205f5742aee98",Article,"Final","",Scopus,2-s2.0-84941045664
"Vallikivi, M., Hultmark, M., Smits, A.J.","36449709600;22957764800;7102735299;","Turbulent boundary layer statistics at very high Reynolds number",2015,"Journal of Fluid Mechanics","779",,,"371","389",,86,"10.1017/jfm.2015.273","https://www.scopus.com/inward/record.uri?eid=2-s2.0-84928392027&doi=10.1017%2fjfm.2015.273&partnerID=40&md5=dd286e2e7a8b6ca4a2f2dd6ae9a72332",Article,"Final","",Scopus,2-s2.0-84928392027
"Fan, Y., Arwatz, G., Van Buren, T.W., Hoffman, D.E., Hultmark, M.","56522039300;24340842900;55252645500;57539982300;22957764800;","Nanoscale sensing devices for turbulence measurements",2015,"Experiments in Fluids","56","7","138","","",13,40,"10.1007/s00348-015-2000-0","https://www.scopus.com/inward/record.uri?eid=2-s2.0-84932633683&doi=10.1007%2fs00348-015-2000-0&partnerID=40&md5=8c88683a5d62171fd9ae62387920def0",Article,"Final","",Scopus,2-s2.0-84932633683
"Jacobi, I., Wexler, J.S., Samaha, M.A., Shang, J.K., Rosenberg, B.J., Hultmark, M., Stone, H.A.","36625709300;37100641600;36919315700;55920465300;55831994800;22957764800;7202564376;","Stratified thin-film flow in a rheometer",2015,"Physics of Fluids","27","5","052102","","",,6,"10.1063/1.4921189","https://www.scopus.com/inward/record.uri?eid=2-s2.0-84930225106&doi=10.1063%2f1.4921189&partnerID=40&md5=8df6979d07cdb98b7cee3d866ad5b9e5",Article,"Final","",Scopus,2-s2.0-84930225106
"Arwatz, G., Fan, Y., Bahri, C., Hultmark, M.","24340842900;56522039300;55946453000;22957764800;","Development and characterization of a nano-scale temperature sensor (T-NSTAP) for turbulent temperature measurements",2015,"Measurement Science and Technology","26","3","035103","","",,11,"10.1088/0957-0233/26/3/035103","https://www.scopus.com/inward/record.uri?eid=2-s2.0-84923169379&doi=10.1088%2f0957-0233%2f26%2f3%2f035103&partnerID=40&md5=099151493b209d554d524c4d8536e5a1",Article,"Final","",Scopus,2-s2.0-84923169379
"Hellström, L.O., Samaha, M., Wang, K., Smits, A., Hultmark, M.","36918497100;36919315700;56990494100;7102735299;22957764800;","Errors in parallel-plate and cone-plate rheometer measurements due to sample underfill",2015,"Measurement Science and Technology","26","1","015301","","",,23,"10.1088/0957-0233/26/1/015301","https://www.scopus.com/inward/record.uri?eid=2-s2.0-84949119679&doi=10.1088%2f0957-0233%2f26%2f1%2f015301&partnerID=40&md5=d914d1ae42ed26595b9433bf62ea0314",Article,"Final","",Scopus,2-s2.0-84949119679
"Smits, A.J., Hultmark, M.","7102735299;22957764800;","Nanoscale instrumentation for measuring turbulence",2014,"Proceedings of the 19th Australasian Fluid Mechanics Conference, AFMC 2014",,,,"","",,3,,"https://www.scopus.com/inward/record.uri?eid=2-s2.0-84959179135&partnerID=40&md5=f9ad315c1dfd725b24bd8b8780e0145d",Conference Paper,"Final","",Scopus,2-s2.0-84959179135
"Bailey, S.C.C., Vallikivi, M., Hultmark, M., Smits, A.J.","24075283000;36449709600;22957764800;7102735299;","Estimating the value of von Kármán's constant in turbulent pipe flow",2014,"Journal of Fluid Mechanics","749",,,"79","98",,78,"10.1017/jfm.2014.208","https://www.scopus.com/inward/record.uri?eid=2-s2.0-84900992977&doi=10.1017%2fjfm.2014.208&partnerID=40&md5=127c6d6327ce644ced41f29e0bd06535",Article,"Final","",Scopus,2-s2.0-84900992977
"Calaf, M., Hultmark, M., Oldroyd, H.J., Simeonov, V., Parlange, M.B.","35799402000;22957764800;55322331200;57203083365;7005375510;","Coherent structures and the k-1 spectral behaviour",2013,"Physics of Fluids","25","12","125107","","",,32,"10.1063/1.4834436","https://www.scopus.com/inward/record.uri?eid=2-s2.0-84891619988&doi=10.1063%2f1.4834436&partnerID=40&md5=a9a40c9193bedaf330efcd1b6c9f00d0",Article,"Final","",Scopus,2-s2.0-84891619988
"Hultmark, M., Calaf, M., Parlange, M.B.","22957764800;35799402000;7005375510;","A new wall shear stress model for atmospheric boundary layer simulations",2013,"Journal of the Atmospheric Sciences","70","11",,"3460","3470",,23,"10.1175/JAS-D-12-0257.1","https://www.scopus.com/inward/record.uri?eid=2-s2.0-84888061562&doi=10.1175%2fJAS-D-12-0257.1&partnerID=40&md5=04e9d928daaf689b223d4c855480dd1a",Article,"Final","All Open Access, Green",Scopus,2-s2.0-84888061562
"Hultmark, M., Vallikivi, M., Bailey, S.C.C., Smits, A.J.","22957764800;36449709600;24075283000;7102735299;","Logarithmic scaling of turbulence in smooth- and rough-wall pipe flow",2013,"Journal of Fluid Mechanics","728",,,"376","395",,109,"10.1017/jfm.2013.255","https://www.scopus.com/inward/record.uri?eid=2-s2.0-84882808404&doi=10.1017%2fjfm.2013.255&partnerID=40&md5=f8d93d26b7203e9e6be8309810a1a57d",Article,"Final","",Scopus,2-s2.0-84882808404
"Bailey, S.C.C., Hultmark, M., Monty, J.P., Alfredsson, P.H., Chong, M.S., Duncan, R.D., Fransson, J.H.M., Hutchins, N., Marusic, I., McKeon, B.J., Nagib, H.M., Örlü, R., Segalini, A., Smits, A.J., Vinuesa, R.","24075283000;22957764800;23028284400;7004165815;7102632142;56276103800;7006333918;15925318900;6603687789;6701372729;7003901660;23020049400;36698382000;7102735299;55553485100;","Obtaining accurate mean velocity measurements in high Reynolds number turbulent boundary layers using Pitot tubes",2013,"Journal of Fluid Mechanics","715",,,"642","670",,67,"10.1017/jfm.2012.538","https://www.scopus.com/inward/record.uri?eid=2-s2.0-84872192450&doi=10.1017%2fjfm.2012.538&partnerID=40&md5=3865bb5faa8346c5c5095e58336b31be",Article,"Final","All Open Access, Green",Scopus,2-s2.0-84872192450
"Vallikivi, M., Hultmark, M., Smits, A.J.","36449709600;22957764800;7102735299;","Mean flow measurements in very high reynolds number turbulent boundary layer",2013,"International Symposium on Turbulence and Shear Flow Phenomena, TSFP 2013","1",,,"","",,,,"https://www.scopus.com/inward/record.uri?eid=2-s2.0-85034052845&partnerID=40&md5=5c3f7425a8ef860ea8e34e93807c883b",Conference Paper,"Final","",Scopus,2-s2.0-85034052845
"Arwatz, G., Bahri, C., Smits, A.J., Hultmark, M.","24340842900;55946453000;7102735299;22957764800;","Dynamic calibration and modeling of a cold wire for temperature measurement",2013,"Measurement Science and Technology","24","12","125301","","",,30,"10.1088/0957-0233/24/12/125301","https://www.scopus.com/inward/record.uri?eid=2-s2.0-84888860001&doi=10.1088%2f0957-0233%2f24%2f12%2f125301&partnerID=40&md5=e4b0236828180e87a2659ebfa084571c",Article,"Final","",Scopus,2-s2.0-84888860001
"Rosenberg, B.J., Hultmark, M., Vallikivi, M., Bailey, S.C.C., Smits, A.J.","55831994800;22957764800;36449709600;24075283000;7102735299;","Turbulence spectra in smooth- and rough-wall pipe flow at extreme Reynolds numbers",2013,"Journal of Fluid Mechanics","731",,,"46","63",,84,"10.1017/jfm.2013.359","https://www.scopus.com/inward/record.uri?eid=2-s2.0-84882803229&doi=10.1017%2fjfm.2013.359&partnerID=40&md5=99c4a8e4046058959dfa7f8beed09a15",Article,"Final","",Scopus,2-s2.0-84882803229
"Marusic, I., Monty, J.P., Hultmark, M., Smits, A.J.","6603687789;23028284400;22957764800;7102735299;","On the logarithmic region in wall turbulence",2013,"Journal of Fluid Mechanics","716",,,"R31","R311",,463,"10.1017/jfm.2012.511","https://www.scopus.com/inward/record.uri?eid=2-s2.0-84873659457&doi=10.1017%2fjfm.2012.511&partnerID=40&md5=4cd92c97cb09ec97ff1c861251b666be",Article,"Final","",Scopus,2-s2.0-84873659457
"Ashok, A., Bailey, S.C.C., Hultmark, M., Smits, A.J.","37116382900;24075283000;22957764800;7102735299;","Hot-wire spatial resolution effects in measurements of grid-generated turbulence",2012,"Experiments in Fluids","53","6",,"1713","1722",,29,"10.1007/s00348-012-1382-5","https://www.scopus.com/inward/record.uri?eid=2-s2.0-84874661353&doi=10.1007%2fs00348-012-1382-5&partnerID=40&md5=22525988d2adb946d7e2e460d5c71c42",Article,"Final","",Scopus,2-s2.0-84874661353
"Hultmark, M.","22957764800;","A theory for the streamwise turbulent fluctuations in high Reynolds number pipe flow",2012,"Journal of Fluid Mechanics","707",,,"575","584",,27,"10.1017/jfm.2012.307","https://www.scopus.com/inward/record.uri?eid=2-s2.0-84866065840&doi=10.1017%2fjfm.2012.307&partnerID=40&md5=41f03e70ab2dd95e1f821bc0024107af",Article,"Final","All Open Access, Green",Scopus,2-s2.0-84866065840
"Hultmark, M., Vallikivi, M., Bailey, S.C.C., Smits, A.J.","22957764800;36449709600;24075283000;7102735299;","Turbulent pipe flow at extreme reynolds numbers",2012,"Physical Review Letters","108","9","094501","","",,260,"10.1103/PhysRevLett.108.094501","https://www.scopus.com/inward/record.uri?eid=2-s2.0-84857539211&doi=10.1103%2fPhysRevLett.108.094501&partnerID=40&md5=915018aab28340493c6fd895f19fcfed",Article,"Final","All Open Access, Bronze",Scopus,2-s2.0-84857539211
"Vallikivi, M., Hultmark, M., Smits, A.J.","36449709600;22957764800;7102735299;","Turbulence measurements at high Reynolds numbers using a new inclined Nano-Scale Thermal Anemometry Probe",2012,"Proceedings of the 18th Australasian Fluid Mechanics Conference, AFMC 2012",,,,"","",,4,,"https://www.scopus.com/inward/record.uri?eid=2-s2.0-84959010957&partnerID=40&md5=596e1e159fd15462e9b7a9715f4b782e",Conference Paper,"Final","",Scopus,2-s2.0-84959010957
"Hutchins, N., Monty, J.P., Baidya, R., Hultmark, M., Smits, A.J.","15925318900;23028284400;54402347100;22957764800;7102735299;","A direct measure of the frequency response of hot-wire anemometers",2012,"Proceedings of the 18th Australasian Fluid Mechanics Conference, AFMC 2012",,,,"","",,,,"https://www.scopus.com/inward/record.uri?eid=2-s2.0-84958999557&partnerID=40&md5=f938d15faf94f600d638df810eb81f26",Conference Paper,"Final","",Scopus,2-s2.0-84958999557
"Vallikivi, M., Hultmark, M., Bailey, S.C.C., Smits, A.J.","36449709600;22957764800;24075283000;7102735299;","Turbulence measurements in pipe flow using a nano-scale thermal anemometry probe",2011,"Experiments in Fluids","51","6",,"1521","1527",,67,"10.1007/s00348-011-1165-4","https://www.scopus.com/inward/record.uri?eid=2-s2.0-82955187804&doi=10.1007%2fs00348-011-1165-4&partnerID=40&md5=ee710bf56c610ef8bc9c14b9dd602072",Article,"Final","",Scopus,2-s2.0-82955187804
"Hultmark, M., Aristoff, J.M., Stone, H.A.","22957764800;6506276485;7202564376;","The influence of the gas phase on liquid imbibition in capillary tubes",2011,"Journal of Fluid Mechanics","678",,,"600","606",,46,"10.1017/jfm.2011.160","https://www.scopus.com/inward/record.uri?eid=2-s2.0-79960142062&doi=10.1017%2fjfm.2011.160&partnerID=40&md5=046004da791f37441df147b6ed2c9739",Article,"Final","",Scopus,2-s2.0-79960142062
"Smits, A.J., Monty, J., Hultmark, M., Bailey, S.C.C., Hutchins, N., Marusic, I.","7102735299;23028284400;22957764800;24075283000;15925318900;6603687789;","Spatial resolution correction for wall-bounded turbulence measurements",2011,"Journal of Fluid Mechanics","676",,,"41","53",,93,"10.1017/jfm.2011.19","https://www.scopus.com/inward/record.uri?eid=2-s2.0-85027939556&doi=10.1017%2fjfm.2011.19&partnerID=40&md5=9ae244a811b1967cef37ba143544f3d3",Article,"Final","",Scopus,2-s2.0-85027939556
"Ashok, A., Hultmark, M., Smits, A.J., Bailey, S.C.C.","37116382900;22957764800;7102735299;24075283000;","Hot wire spatial resolution effects in measurements of grid generated turbulence",2011,"7th International Symposium on Turbulence and Shear Flow Phenomena, TSFP 2011","2011-July",,,"","",,,,"https://www.scopus.com/inward/record.uri?eid=2-s2.0-85048578271&partnerID=40&md5=aa7b917cd591ae174156263c3dca45d9",Conference Paper,"Final","",Scopus,2-s2.0-85048578271
"Smits, A.J., Hultmark, M., Vallikivi, M., Rosenberg, B.J., Bailey, S.C.C.","7102735299;22957764800;36449709600;55831994800;24075283000;","Pipe flow turbulence at extreme reynolds numbers",2011,"7th International Symposium on Turbulence and Shear Flow Phenomena, TSFP 2011","2011-July",,,"","",,5,,"https://www.scopus.com/inward/record.uri?eid=2-s2.0-85034056303&partnerID=40&md5=f405e03187741d78bc8e73bf16d26f88",Conference Paper,"Final","",Scopus,2-s2.0-85034056303
"Hultmark, M., Ashok, A., Smits, A.J.","22957764800;37116382900;7102735299;","A new criterion for end-conduction effects in hot-wire anemometry",2011,"Measurement Science and Technology","22","5","055401","","",,30,"10.1088/0957-0233/22/5/055401","https://www.scopus.com/inward/record.uri?eid=2-s2.0-79954582741&doi=10.1088%2f0957-0233%2f22%2f5%2f055401&partnerID=40&md5=4303fb44a2b02fdda76b7105a466bde9",Article,"Final","",Scopus,2-s2.0-79954582741
"Hultmark, M., Leftwich, M., Smits, A.J.","22957764800;6602560606;7102735299;","Flowfield measurements in the wake of a robotic lamprey",2010,"Animal Locomotion",,,,"45","52",,2,"10.1007/978-3-642-11633-9_5","https://www.scopus.com/inward/record.uri?eid=2-s2.0-84886211826&doi=10.1007%2f978-3-642-11633-9_5&partnerID=40&md5=674c75937c9de9e4a40273fd361975fd",Book Chapter,"Final","",Scopus,2-s2.0-84886211826
"Bailey, S.C.C., Kunkel, G.J., Hultmark, M., Vallikivi, M., Hill, J.P., Meyer, K.A., Tsay, C., Arnold, C.B., Smits, A.J.","24075283000;7102569046;22957764800;36449709600;56307913500;36704109100;7005521483;7203014096;7102735299;","Turbulence measurements using a nanoscale thermal anemometry probe",2010,"Journal of Fluid Mechanics","663",,,"160","179",,127,"10.1017/S0022112010003447","https://www.scopus.com/inward/record.uri?eid=2-s2.0-78649918288&doi=10.1017%2fS0022112010003447&partnerID=40&md5=571720c26ad281fc63f4274390ef84c6",Article,"Final","",Scopus,2-s2.0-78649918288
"Hultmark, M., Bailey, S.C.C., Smits, A.J.","22957764800;24075283000;7102735299;","Scaling of near-wall turbulence in pipe flow",2010,"Journal of Fluid Mechanics","649",,,"103","113",,77,"10.1017/S0022112009994071","https://www.scopus.com/inward/record.uri?eid=2-s2.0-77952356625&doi=10.1017%2fS0022112009994071&partnerID=40&md5=028d19760d870127803dbd3f688f6aed",Article,"Final","",Scopus,2-s2.0-77952356625
"Hultmark, M., Smits, A.J.","22957764800;7102735299;","Temperature corrections for constant temperature and constant current hot-wire anemometers",2010,"Measurement Science and Technology","21","10","105404","","",,72,"10.1088/0957-0233/21/10/105404","https://www.scopus.com/inward/record.uri?eid=2-s2.0-78149379070&doi=10.1088%2f0957-0233%2f21%2f10%2f105404&partnerID=40&md5=dcb7509050c56a53be3afdbac4f189dd",Article,"Final","",Scopus,2-s2.0-78149379070
"Jiménez, J.M., Hultmark, M., Smits, A.J.","57173538300;22957764800;7102735299;","The intermediate wake of a body of revolution at high Reynolds numbers",2010,"Journal of Fluid Mechanics","659",,,"516","539",,71,"10.1017/S0022112010002715","https://www.scopus.com/inward/record.uri?eid=2-s2.0-77957136373&doi=10.1017%2fS0022112010002715&partnerID=40&md5=0fda4716693eb4588f3a7438532cd518",Article,"Final","",Scopus,2-s2.0-77957136373
"Bailey, S.C.C., Hultmark, M., Schumacher, J., Yakhot, V., Smits, A.J.","24075283000;22957764800;7201769159;7003936103;7102735299;","Measurement of Local Dissipation Scales in Turbulent Pipe Flow",2009,"Physical Review Letters","103","1","014502","","",,32,"10.1103/PhysRevLett.103.014502","https://www.scopus.com/inward/record.uri?eid=2-s2.0-68649092575&doi=10.1103%2fPhysRevLett.103.014502&partnerID=40&md5=bb1ce34e7e11c3ade68b162d6041ffe2",Article,"Final","",Scopus,2-s2.0-68649092575
"Bailey, S.C.C., Hultmark, M., Smits, A.J., Schultz, M.P.","24075283000;22957764800;7102735299;56261594100;","Azimuthal structure of turbulence in high Reynolds number pipe flow",2008,"Journal of Fluid Mechanics","615",,,"121","138",,56,"10.1017/S0022112008003492","https://www.scopus.com/inward/record.uri?eid=2-s2.0-56049099550&doi=10.1017%2fS0022112008003492&partnerID=40&md5=c8702779954553c75161504c7ba459e7",Article,"Final","",Scopus,2-s2.0-56049099550
"Pepe, R.L., Schultz, M.P., Bailey, S., Hultmark, M., Smits, A.J.","54981506600;56261594100;24075283000;22957764800;7102735299;","Flow in a commercial steel pipe",2007,"Proceedings of the 16th Australasian Fluid Mechanics Conference, 16AFMC",,,,"907","913",,,,"https://www.scopus.com/inward/record.uri?eid=2-s2.0-84856901630&partnerID=40&md5=54320c4d444630eb01545288dedc7d1c",Conference Paper,"Final","",Scopus,2-s2.0-84856901630
"Hultmark, M., Leftwich, M., Smits, A.J.","22957764800;6602560606;7102735299;","Flowfield measurements in the wake of a robotic lamprey",2007,"Experiments in Fluids","43","5",,"683","690",,51,"10.1007/s00348-007-0412-1","https://www.scopus.com/inward/record.uri?eid=2-s2.0-35948945012&doi=10.1007%2fs00348-007-0412-1&partnerID=40&md5=d7cab99d842ea34752ffcabe0f47714b",Article,"Final","All Open Access, Green",Scopus,2-s2.0-35948945012
